{
  "$schema": "https://json-schema.org/draft/2020-12/schema",
  "$id": "https://example.org/schemas/arre_record.schema.json",
  "title": "ARRE Record",
  "description": "Assurance, Risk, and Regulatory Evidence record schema for regulator-facing controls.",
  "type": "object",
  "additionalProperties": false,
  "required": [
    "control_id",
    "objective",
    "policy_version",
    "control_owner",
    "period",
    "effectiveness",
    "evidence_hashes",
    "approvals",
    "attestation"
  ],
  "properties": {
    "control_id": {
      "type": "string",
      "pattern": "^[A-Z0-9_-]{4,64}$"
    },
    "objective": {
      "type": "string",
      "minLength": 10,
      "maxLength": 512
    },
    "legal_basis": {
      "type": "array",
      "items": {
        "type": "string",
        "minLength": 2,
        "maxLength": 128
      }
    },
    "policy_version": {
      "type": "string",
      "minLength": 1,
      "maxLength": 32
    },
    "control_owner": {
      "type": "string",
      "minLength": 2,
      "maxLength": 128
    },
    "period": {
      "type": "object",
      "additionalProperties": false,
      "required": ["start", "end"],
      "properties": {
        "start": { "type": "string", "format": "date" },
        "end": { "type": "string", "format": "date" }
      }
    },
    "effectiveness": {
      "type": "object",
      "additionalProperties": false,
      "required": ["pass_rate", "exceptions"],
      "properties": {
        "pass_rate": { "type": "number", "minimum": 0, "maximum": 1 },
        "exceptions": { "type": "integer", "minimum": 0 },
        "confidence_interval_95": {
          "type": "object",
          "additionalProperties": false,
          "required": ["lower", "upper"],
          "properties": {
            "lower": { "type": "number", "minimum": 0, "maximum": 1 },
            "upper": { "type": "number", "minimum": 0, "maximum": 1 }
          }
        }
      }
    },
    "exceptions": {
      "type": "array",
      "items": {
        "type": "object",
        "additionalProperties": false,
        "required": ["id", "severity", "status"],
        "properties": {
          "id": { "type": "string", "minLength": 2, "maxLength": 64 },
          "severity": { "type": "string", "enum": ["low", "medium", "high", "critical"] },
          "status": { "type": "string", "enum": ["open", "mitigated", "closed"] },
          "compensating_control": { "type": "string", "maxLength": 512 }
        }
      }
    },
    "waivers": {
      "type": "array",
      "items": {
        "type": "object",
        "additionalProperties": false,
        "required": ["waiver_id", "approved_by", "expires_at"],
        "properties": {
          "waiver_id": { "type": "string", "minLength": 2, "maxLength": 64 },
          "approved_by": { "type": "string", "minLength": 2, "maxLength": 128 },
          "expires_at": { "type": "string", "format": "date" }
        }
      }
    },
    "evidence_hashes": {
      "type": "array",
      "minItems": 1,
      "items": {
        "type": "string",
        "pattern": "^[a-fA-F0-9]{32,128}$"
      }
    },
    "approvals": {
      "type": "array",
      "minItems": 1,
      "items": {
        "type": "object",
        "additionalProperties": false,
        "required": ["role", "approved_by", "approved_at"],
        "properties": {
          "role": { "type": "string", "minLength": 2, "maxLength": 64 },
          "approved_by": { "type": "string", "minLength": 2, "maxLength": 128 },
          "approved_at": { "type": "string", "format": "date-time" }
        }
      }
    },
    "attestation": {
      "type": "object",
      "additionalProperties": false,
      "required": ["algorithm", "signed_by", "signed_at", "digest"],
      "properties": {
        "algorithm": { "type": "string", "minLength": 2, "maxLength": 64 },
        "signed_by": { "type": "string", "minLength": 2, "maxLength": 128 },
        "signed_at": { "type": "string", "format": "date-time" },
        "digest": { "type": "string", "minLength": 16, "maxLength": 256 }
      }
    }
  }
}
